{
  "$schema": "https://json-schema.org/draft/2020-12/schema",
  "$id": "https://schemas.aiptc.dev/contracts/v0.1.0/Evidence.schema.json",
  "title": "Evidence",
  "description": "A verifiable observation supporting or refuting a finding.",
  "x-contract": {
    "id": "Evidence",
    "group": "domain",
    "contractsVersion": "0.1.0",
    "foundational": false
  },
  "type": "object",
  "properties": {
    "id": {
      "type": "string",
      "pattern": "^evd_(?:[0-9A-HJKMNP-TV-Z]{26}|[0-9a-fA-F]{8}-[0-9a-fA-F]{4}-[0-9a-fA-F]{4}-[0-9a-fA-F]{4}-[0-9a-fA-F]{12})$",
      "description": "Evidence identifier (`evd_<ulid|uuid>`)"
    },
    "kind": {
      "type": "string",
      "enum": [
        "observation",
        "request-response",
        "command-output",
        "screenshot",
        "file-content",
        "configuration",
        "log-excerpt",
        "proof-of-concept",
        "model-reasoning",
        "third-party-report"
      ]
    },
    "summary": {
      "type": "string",
      "minLength": 1,
      "maxLength": 200,
      "description": "Short human-readable label"
    },
    "detail": {
      "type": "string",
      "maxLength": 8000,
      "description": "Human-readable description (markdown allowed)"
    },
    "collectedAt": {
      "type": "string",
      "format": "date-time",
      "pattern": "^(?:(?:\\d\\d[2468][048]|\\d\\d[13579][26]|\\d\\d0[48]|[02468][048]00|[13579][26]00)-02-29|\\d{4}-(?:(?:0[13578]|1[02])-(?:0[1-9]|[12]\\d|3[01])|(?:0[469]|11)-(?:0[1-9]|[12]\\d|30)|(?:02)-(?:0[1-9]|1\\d|2[0-8])))T(?:(?:[01]\\d|2[0-3]):[0-5]\\d(?::[0-5]\\d(?:\\.\\d+)?)?(?:Z|([+-](?:[01]\\d|2[0-3]):[0-5]\\d)))$",
      "description": "RFC 3339 timestamp with explicit UTC offset, e.g. 2026-07-30T10:15:00.000Z"
    },
    "collectedBy": {
      "type": "string",
      "pattern": "^act_(?:[0-9A-HJKMNP-TV-Z]{26}|[0-9a-fA-F]{8}-[0-9a-fA-F]{4}-[0-9a-fA-F]{4}-[0-9a-fA-F]{4}-[0-9a-fA-F]{12})$",
      "description": "Actor identifier (`act_<ulid|uuid>`)"
    },
    "sessionId": {
      "type": "string",
      "pattern": "^ses_(?:[0-9A-HJKMNP-TV-Z]{26}|[0-9a-fA-F]{8}-[0-9a-fA-F]{4}-[0-9a-fA-F]{4}-[0-9a-fA-F]{4}-[0-9a-fA-F]{12})$",
      "description": "Session identifier (`ses_<ulid|uuid>`)"
    },
    "targetId": {
      "type": "string",
      "pattern": "^tgt_(?:[0-9A-HJKMNP-TV-Z]{26}|[0-9a-fA-F]{8}-[0-9a-fA-F]{4}-[0-9a-fA-F]{4}-[0-9a-fA-F]{4}-[0-9a-fA-F]{12})$",
      "description": "Target asset identifier (`tgt_<ulid|uuid>`)"
    },
    "artifactIds": {
      "maxItems": 64,
      "type": "array",
      "items": {
        "type": "string",
        "pattern": "^art_(?:[0-9A-HJKMNP-TV-Z]{26}|[0-9a-fA-F]{8}-[0-9a-fA-F]{4}-[0-9a-fA-F]{4}-[0-9a-fA-F]{4}-[0-9a-fA-F]{12})$",
        "description": "Artifact identifier (`art_<ulid|uuid>`)"
      }
    },
    "reproduction": {
      "type": "object",
      "properties": {
        "tool": {
          "type": "string",
          "maxLength": 200
        },
        "command": {
          "type": "string",
          "maxLength": 8000
        },
        "request": {
          "type": "string",
          "maxLength": 16000
        },
        "response": {
          "type": "string",
          "maxLength": 16000
        },
        "notes": {
          "type": "string",
          "maxLength": 8000,
          "description": "Human-readable description (markdown allowed)"
        }
      },
      "additionalProperties": false
    },
    "confidence": {
      "type": "number",
      "minimum": 0,
      "maximum": 1,
      "description": "Value in the closed interval [0, 1]"
    },
    "humanVerified": {
      "type": "boolean"
    },
    "extensions": {
      "type": "object",
      "propertyNames": {
        "type": "string",
        "pattern": "^[a-z0-9]([a-z0-9._:-]{0,62}[a-z0-9])?$"
      },
      "additionalProperties": {
        "$ref": "https://schemas.aiptc.dev/contracts/v0.1.0/__shared.schema.json#/$defs/JsonValue"
      },
      "description": "Namespaced, non-contractual extension data. Unknown keys MUST be ignored."
    }
  },
  "required": [
    "id",
    "kind",
    "summary",
    "collectedAt"
  ],
  "additionalProperties": false
}
